{
  "format": "malbolge-dimension-epoch-ladder/1",
  "schema_version": 1,
  "profile": "TOY_ZERO_OFFSET",
  "memory_model": "SPARSE_TOY",
  "source": "ubO",
  "dimensions": [
    10,
    11,
    12,
    13,
    14,
    15,
    16,
    17,
    18,
    19
  ],
  "epochs": [
    {
      "schema_version": 1,
      "profile": "TOY_ZERO_OFFSET",
      "memory_model": "SPARSE_TOY",
      "dimension": 10,
      "memory_cells": 59049,
      "source": "ubO",
      "source_sha256": "681f8033410df7a4a5d7eaa3f8c730929459de77ed4fd27cac02cd813ab36c0c",
      "state_before_hex": "5a",
      "state_after_hex": "5a",
      "state_before_sha256": "bbeebd879e1dff6918546dc0c179fdde505f2a21591c9a9c96e36b054ec5af83",
      "state_after_sha256": "bbeebd879e1dff6918546dc0c179fdde505f2a21591c9a9c96e36b054ec5af83",
      "decoded_ops": [
        23,
        5,
        81
      ],
      "status": "HALTED",
      "steps": 3,
      "final_a": 90,
      "final_c": 2,
      "final_d": 2
    },
    {
      "schema_version": 1,
      "profile": "TOY_ZERO_OFFSET",
      "memory_model": "SPARSE_TOY",
      "dimension": 11,
      "memory_cells": 177147,
      "source": "ubO",
      "source_sha256": "681f8033410df7a4a5d7eaa3f8c730929459de77ed4fd27cac02cd813ab36c0c",
      "state_before_hex": "5a",
      "state_after_hex": "5a",
      "state_before_sha256": "bbeebd879e1dff6918546dc0c179fdde505f2a21591c9a9c96e36b054ec5af83",
      "state_after_sha256": "bbeebd879e1dff6918546dc0c179fdde505f2a21591c9a9c96e36b054ec5af83",
      "decoded_ops": [
        23,
        5,
        81
      ],
      "status": "HALTED",
      "steps": 3,
      "final_a": 90,
      "final_c": 2,
      "final_d": 2
    },
    {
      "schema_version": 1,
      "profile": "TOY_ZERO_OFFSET",
      "memory_model": "SPARSE_TOY",
      "dimension": 12,
      "memory_cells": 531441,
      "source": "ubO",
      "source_sha256": "681f8033410df7a4a5d7eaa3f8c730929459de77ed4fd27cac02cd813ab36c0c",
      "state_before_hex": "5a",
      "state_after_hex": "5a",
      "state_before_sha256": "bbeebd879e1dff6918546dc0c179fdde505f2a21591c9a9c96e36b054ec5af83",
      "state_after_sha256": "bbeebd879e1dff6918546dc0c179fdde505f2a21591c9a9c96e36b054ec5af83",
      "decoded_ops": [
        23,
        5,
        81
      ],
      "status": "HALTED",
      "steps": 3,
      "final_a": 90,
      "final_c": 2,
      "final_d": 2
    },
    {
      "schema_version": 1,
      "profile": "TOY_ZERO_OFFSET",
      "memory_model": "SPARSE_TOY",
      "dimension": 13,
      "memory_cells": 1594323,
      "source": "ubO",
      "source_sha256": "681f8033410df7a4a5d7eaa3f8c730929459de77ed4fd27cac02cd813ab36c0c",
      "state_before_hex": "5a",
      "state_after_hex": "5a",
      "state_before_sha256": "bbeebd879e1dff6918546dc0c179fdde505f2a21591c9a9c96e36b054ec5af83",
      "state_after_sha256": "bbeebd879e1dff6918546dc0c179fdde505f2a21591c9a9c96e36b054ec5af83",
      "decoded_ops": [
        23,
        5,
        81
      ],
      "status": "HALTED",
      "steps": 3,
      "final_a": 90,
      "final_c": 2,
      "final_d": 2
    },
    {
      "schema_version": 1,
      "profile": "TOY_ZERO_OFFSET",
      "memory_model": "SPARSE_TOY",
      "dimension": 14,
      "memory_cells": 4782969,
      "source": "ubO",
      "source_sha256": "681f8033410df7a4a5d7eaa3f8c730929459de77ed4fd27cac02cd813ab36c0c",
      "state_before_hex": "5a",
      "state_after_hex": "5a",
      "state_before_sha256": "bbeebd879e1dff6918546dc0c179fdde505f2a21591c9a9c96e36b054ec5af83",
      "state_after_sha256": "bbeebd879e1dff6918546dc0c179fdde505f2a21591c9a9c96e36b054ec5af83",
      "decoded_ops": [
        23,
        5,
        81
      ],
      "status": "HALTED",
      "steps": 3,
      "final_a": 90,
      "final_c": 2,
      "final_d": 2
    },
    {
      "schema_version": 1,
      "profile": "TOY_ZERO_OFFSET",
      "memory_model": "SPARSE_TOY",
      "dimension": 15,
      "memory_cells": 14348907,
      "source": "ubO",
      "source_sha256": "681f8033410df7a4a5d7eaa3f8c730929459de77ed4fd27cac02cd813ab36c0c",
      "state_before_hex": "5a",
      "state_after_hex": "5a",
      "state_before_sha256": "bbeebd879e1dff6918546dc0c179fdde505f2a21591c9a9c96e36b054ec5af83",
      "state_after_sha256": "bbeebd879e1dff6918546dc0c179fdde505f2a21591c9a9c96e36b054ec5af83",
      "decoded_ops": [
        23,
        5,
        81
      ],
      "status": "HALTED",
      "steps": 3,
      "final_a": 90,
      "final_c": 2,
      "final_d": 2
    },
    {
      "schema_version": 1,
      "profile": "TOY_ZERO_OFFSET",
      "memory_model": "SPARSE_TOY",
      "dimension": 16,
      "memory_cells": 43046721,
      "source": "ubO",
      "source_sha256": "681f8033410df7a4a5d7eaa3f8c730929459de77ed4fd27cac02cd813ab36c0c",
      "state_before_hex": "5a",
      "state_after_hex": "5a",
      "state_before_sha256": "bbeebd879e1dff6918546dc0c179fdde505f2a21591c9a9c96e36b054ec5af83",
      "state_after_sha256": "bbeebd879e1dff6918546dc0c179fdde505f2a21591c9a9c96e36b054ec5af83",
      "decoded_ops": [
        23,
        5,
        81
      ],
      "status": "HALTED",
      "steps": 3,
      "final_a": 90,
      "final_c": 2,
      "final_d": 2
    },
    {
      "schema_version": 1,
      "profile": "TOY_ZERO_OFFSET",
      "memory_model": "SPARSE_TOY",
      "dimension": 17,
      "memory_cells": 129140163,
      "source": "ubO",
      "source_sha256": "681f8033410df7a4a5d7eaa3f8c730929459de77ed4fd27cac02cd813ab36c0c",
      "state_before_hex": "5a",
      "state_after_hex": "5a",
      "state_before_sha256": "bbeebd879e1dff6918546dc0c179fdde505f2a21591c9a9c96e36b054ec5af83",
      "state_after_sha256": "bbeebd879e1dff6918546dc0c179fdde505f2a21591c9a9c96e36b054ec5af83",
      "decoded_ops": [
        23,
        5,
        81
      ],
      "status": "HALTED",
      "steps": 3,
      "final_a": 90,
      "final_c": 2,
      "final_d": 2
    },
    {
      "schema_version": 1,
      "profile": "TOY_ZERO_OFFSET",
      "memory_model": "SPARSE_TOY",
      "dimension": 18,
      "memory_cells": 387420489,
      "source": "ubO",
      "source_sha256": "681f8033410df7a4a5d7eaa3f8c730929459de77ed4fd27cac02cd813ab36c0c",
      "state_before_hex": "5a",
      "state_after_hex": "5a",
      "state_before_sha256": "bbeebd879e1dff6918546dc0c179fdde505f2a21591c9a9c96e36b054ec5af83",
      "state_after_sha256": "bbeebd879e1dff6918546dc0c179fdde505f2a21591c9a9c96e36b054ec5af83",
      "decoded_ops": [
        23,
        5,
        81
      ],
      "status": "HALTED",
      "steps": 3,
      "final_a": 90,
      "final_c": 2,
      "final_d": 2
    },
    {
      "schema_version": 1,
      "profile": "TOY_ZERO_OFFSET",
      "memory_model": "SPARSE_TOY",
      "dimension": 19,
      "memory_cells": 1162261467,
      "source": "ubO",
      "source_sha256": "681f8033410df7a4a5d7eaa3f8c730929459de77ed4fd27cac02cd813ab36c0c",
      "state_before_hex": "5a",
      "state_after_hex": "5a",
      "state_before_sha256": "bbeebd879e1dff6918546dc0c179fdde505f2a21591c9a9c96e36b054ec5af83",
      "state_after_sha256": "bbeebd879e1dff6918546dc0c179fdde505f2a21591c9a9c96e36b054ec5af83",
      "decoded_ops": [
        23,
        5,
        81
      ],
      "status": "HALTED",
      "steps": 3,
      "final_a": 90,
      "final_c": 2,
      "final_d": 2
    }
  ],
  "final_state_hex": "5a"
}